{
  "kind": "brokkr-placement-observation", "schema_version": "v1", "observation_id": "placement-drift-001", "observed_at": "2026-07-23T08:00:00Z", "valid_until": "2026-07-23T11:00:00Z",
  "evidence": { "evidence_id": "evidence-drift-001", "producer": "brokkr", "observed_at": "2026-07-23T08:00:00Z", "digest": "sha256:4e84fb07522c819fd317a7d2ebc94262e2abd54f196a352de52adacf3afe8d63" },
  "node_capabilities": [{ "kind": "node-capability", "schema_version": "v1", "node_id": "node-huginmunin", "observed_at": "2026-07-23T08:00:00Z", "valid_until": "2026-07-23T09:00:00Z", "evidence": { "evidence_id": "evidence-huginmunin-stale-001", "producer": "brokkr", "observed_at": "2026-07-23T08:00:00Z", "digest": "sha256:2a73e7e2d147f13127a41d26c1448c8752cee87ffd8c212bdcdceb9217d6db71" }, "capability_status": "known", "architecture": "arm64", "resources": { "cpu_cores": 4, "memory_mib": 8192 }, "uptime_class": "always_on", "network_capabilities": ["wired"], "logical_storage": [{ "class": "local_ssd", "available_mib": 100000, "status": "known" }], "service_manager": "systemd", "deployment_mechanisms": ["guarded_deploy"], "health_reporting": "supported", "extensions": [] }],
  "workloads": [{ "workload_id": "workload-hugin", "node_id": "node-huginmunin", "deployed": "missing", "running": "unknown", "healthy": "unknown", "units": ["hugin", "hugin-daily-exam-factory", "hugin-experiment-cadence", "hugin-10", "hugin-2"] }],
  "capability_assessments": [{ "workload_id": "workload-hugin", "node_id": "node-huginmunin", "requirement_kind": "workload-requirement", "requirement_schema_version": "v1", "requirement_producer": "hugin", "requirement_digest": "sha256:04a18def4314e569c9f9ffa76fcfb4a5bf1e34973f84721a4d8467788a16f2c4", "compatibility": "incompatible" }]
}
