{
  "kind": "brokkr-placement-observation", "schema_version": "v1", "observation_id": "placement-hugin-m5-001", "observed_at": "2026-07-23T10:00:00Z", "valid_until": "2026-07-23T11:00:00Z",
  "evidence": { "evidence_id": "evidence-hugin-m5-001", "producer": "brokkr", "observed_at": "2026-07-23T10:00:00Z", "digest": "sha256:92c8b19fbc91a16f8f3e09038b095c10653378ae14a783252683719936210be4" },
  "node_capabilities": [{ "kind": "node-capability", "schema_version": "v1", "node_id": "node-m5", "observed_at": "2026-07-23T10:00:00Z", "valid_until": "2026-07-23T11:00:00Z", "evidence": { "evidence_id": "evidence-m5-placement-001", "producer": "brokkr", "observed_at": "2026-07-23T10:00:00Z", "digest": "sha256:3acb56804706e73cb7e26a9f068b5a1a40a411eb2da4128215d739474855cfd9" }, "capability_status": "known", "architecture": "x86_64", "resources": { "cpu_cores": 16, "memory_mib": 131072 }, "uptime_class": "always_on", "network_capabilities": ["wired", "tailnet"], "logical_storage": [{ "class": "local_ssd", "available_mib": 500000, "status": "known" }], "service_manager": "systemd", "deployment_mechanisms": ["guarded_deploy", "systemd"], "health_reporting": "supported", "extensions": [] }],
  "workloads": [{ "workload_id": "workload-hugin", "node_id": "node-m5", "deployed": "deployed", "running": "running", "healthy": "healthy", "units": ["hugin"] }],
  "capability_assessments": [{ "workload_id": "workload-hugin", "node_id": "node-m5", "requirement_kind": "workload-requirement", "requirement_schema_version": "v1", "requirement_producer": "hugin", "requirement_digest": "sha256:04a18def4314e569c9f9ffa76fcfb4a5bf1e34973f84721a4d8467788a16f2c4", "compatibility": "compatible" }]
}
