{
  "kind": "brokkr-placement-observation",
  "schema_version": "v1",
  "observation_id": "placement-current-001",
  "observed_at": "2026-07-23T10:00:00Z",
  "valid_until": "2026-07-23T11:00:00Z",
  "evidence": { "evidence_id": "evidence-current-001", "producer": "brokkr", "observed_at": "2026-07-23T10:00:00Z", "digest": "sha256:f575c2ddf1f66007ff35d3035a2cd909febdc14be99428a6d28c9440af881c59" },
  "node_capabilities": [
    { "kind": "node-capability", "schema_version": "v1", "node_id": "node-huginmunin", "observed_at": "2026-07-23T10:00:00Z", "valid_until": "2026-07-23T11:00:00Z", "evidence": { "evidence_id": "evidence-huginmunin-001", "producer": "brokkr", "observed_at": "2026-07-23T10:00:00Z", "digest": "sha256:a012cde7bf86cb7d616aa9854957e25a42c7ba5dc2606cd10d1eb4b561525819" }, "capability_status": "known", "architecture": "arm64", "resources": { "cpu_cores": 4, "memory_mib": 8192 }, "uptime_class": "always_on", "network_capabilities": ["wired", "tailnet"], "logical_storage": [{ "class": "local_ssd", "available_mib": 100000, "status": "known" }], "service_manager": "systemd", "deployment_mechanisms": ["guarded_deploy", "systemd"], "health_reporting": "supported", "extensions": [] },
    { "kind": "node-capability", "schema_version": "v1", "node_id": "node-nas", "observed_at": "2026-07-23T10:00:00Z", "valid_until": "2026-07-23T11:00:00Z", "evidence": { "evidence_id": "evidence-nas-001", "producer": "brokkr", "observed_at": "2026-07-23T10:00:00Z", "digest": "sha256:384f98e8992a08f180a52799ee7cca5cea5b46c41c206aa6a9b84a15c50ac8fe" }, "capability_status": "known", "architecture": "x86_64", "resources": { "cpu_cores": 4, "memory_mib": 16384 }, "uptime_class": "always_on", "network_capabilities": ["wired", "tailnet"], "logical_storage": [{ "class": "network_share", "available_mib": 100000, "status": "known" }], "service_manager": "systemd", "deployment_mechanisms": ["guarded_deploy", "systemd"], "health_reporting": "supported", "extensions": [] },
    { "kind": "node-capability", "schema_version": "v1", "node_id": "node-m5", "observed_at": "2026-07-23T10:00:00Z", "valid_until": "2026-07-23T11:00:00Z", "evidence": { "evidence_id": "evidence-m5-001", "producer": "brokkr", "observed_at": "2026-07-23T10:00:00Z", "digest": "sha256:221a914cdd15a15361f35345a910919a5b1799f73cd9e46329b4a50451041894" }, "capability_status": "known", "architecture": "x86_64", "resources": { "cpu_cores": 16, "memory_mib": 131072 }, "uptime_class": "always_on", "network_capabilities": ["wired", "tailnet"], "logical_storage": [{ "class": "local_ssd", "available_mib": 500000, "status": "known" }], "service_manager": "systemd", "deployment_mechanisms": ["guarded_deploy", "systemd"], "health_reporting": "supported", "extensions": [] }
  ],
  "workloads": [
    { "workload_id": "workload-munin-memory", "node_id": "node-huginmunin", "deployed": "deployed", "running": "running", "healthy": "healthy", "units": ["munin-memory"] },
    { "workload_id": "workload-hugin", "node_id": "node-huginmunin", "deployed": "deployed", "running": "running", "healthy": "healthy", "units": ["hugin"] },
    { "workload_id": "workload-heimdall", "node_id": "node-huginmunin", "deployed": "deployed", "running": "running", "healthy": "healthy", "units": ["heimdall", "heimdall-collect", "heimdall-maintain", "heimdall-boot-check"] },
    { "workload_id": "workload-ratatoskr", "node_id": "node-huginmunin", "deployed": "deployed", "running": "running", "healthy": "healthy", "units": ["ratatoskr"] },
    { "workload_id": "workload-skuld", "node_id": "node-huginmunin", "deployed": "deployed", "running": "running", "healthy": "not_applicable", "units": ["skuld"] },
    { "workload_id": "workload-mimir", "node_id": "node-nas", "deployed": "deployed", "running": "running", "healthy": "healthy", "units": ["mimir"] },
    { "workload_id": "workload-grimnir", "node_id": "node-huginmunin", "deployed": "deployed", "running": "running", "healthy": "not_applicable", "units": ["grimnir-security-scan", "grimnir-validate"] },
    { "workload_id": "workload-verdandi", "node_id": "node-huginmunin", "deployed": "deployed", "running": "stopped", "healthy": "not_applicable", "units": ["verdandi"] },
    { "workload_id": "workload-brokkr", "node_id": "node-huginmunin", "deployed": "not_applicable", "running": "running", "healthy": "not_applicable", "units": ["brokkr-maintenance-os", "brokkr-maintenance-deps"] }
  ],
  "capability_assessments": [
    { "workload_id": "workload-munin-memory", "node_id": "node-huginmunin", "requirement_kind": "workload-requirement", "requirement_schema_version": "v1", "requirement_producer": "munin-memory", "requirement_digest": "sha256:754071860f784ef02c74951e56d857fb30ff1a5724bec28d45cc091bb5441804", "compatibility": "compatible" },
    { "workload_id": "workload-hugin", "node_id": "node-huginmunin", "requirement_kind": "workload-requirement", "requirement_schema_version": "v1", "requirement_producer": "hugin", "requirement_digest": "sha256:04a18def4314e569c9f9ffa76fcfb4a5bf1e34973f84721a4d8467788a16f2c4", "compatibility": "compatible" },
    { "workload_id": "workload-heimdall", "node_id": "node-huginmunin", "requirement_kind": "workload-requirement", "requirement_schema_version": "v1", "requirement_producer": "heimdall", "requirement_digest": "sha256:ad003f4198f2c4d04515afbdc51463eda477805ecff6717e8e4f69a0deb7448f", "compatibility": "compatible" },
    { "workload_id": "workload-ratatoskr", "node_id": "node-huginmunin", "requirement_kind": "workload-requirement", "requirement_schema_version": "v1", "requirement_producer": "ratatoskr", "requirement_digest": "sha256:23a1dd98a93a718b28b452ff352017dbc65f2105686df3677dae55713cd28621", "compatibility": "compatible" },
    { "workload_id": "workload-skuld", "node_id": "node-huginmunin", "requirement_kind": "workload-requirement", "requirement_schema_version": "v1", "requirement_producer": "skuld", "requirement_digest": "sha256:e482a322b1eaa8cc4a6ee3d05860be3dcd24e7f83dd5378c8644a5034a902b5c", "compatibility": "compatible" },
    { "workload_id": "workload-mimir", "node_id": "node-nas", "requirement_kind": "workload-requirement", "requirement_schema_version": "v1", "requirement_producer": "mimir", "requirement_digest": "sha256:f81faff9605d81db9b4c2de4ed3d1540d0628144375af7b9fc7fa5034d76bfdd", "compatibility": "compatible" },
    { "workload_id": "workload-grimnir", "node_id": "node-huginmunin", "requirement_kind": "workload-requirement", "requirement_schema_version": "v1", "requirement_producer": "grimnir", "requirement_digest": "sha256:5b6beb419c57989353f52ccd2f6cd667b781de287d3790d680e0dbb4f79e6add", "compatibility": "compatible" },
    { "workload_id": "workload-verdandi", "node_id": "node-huginmunin", "requirement_kind": "workload-requirement", "requirement_schema_version": "v1", "requirement_producer": "verdandi", "requirement_digest": "sha256:c52adb8e298a016033f79c1f53a4cc797ab0e5f10b7f001fb2206659306d29d8", "compatibility": "compatible" },
    { "workload_id": "workload-brokkr", "node_id": "node-huginmunin", "requirement_kind": "workload-requirement", "requirement_schema_version": "v1", "requirement_producer": "brokkr", "requirement_digest": "sha256:1f72de8ec7b7b308f262f0b8282d213af011c3369345ca54dcf08f08bc76cee0", "compatibility": "compatible" }
  ]
}
